{
  "operation_id": "demo-bar-th-179-complete",
  "fiche_code": "BAR-TH-179",
  "source_summary": "Cas anonymise complet : copropriete existante, PAC collective air/eau chauffage + ECS.",
  "beneficiary": {
    "type": "copropriete",
    "name": "Beneficiaire Exemple",
    "address": "10 rue de l'Exemple, 69000 Lyon",
    "siren": null
  },
  "site": {
    "address": "10 rue de l'Exemple, 69000 Lyon",
    "postal_code": "69000",
    "climate_zone": "H1",
    "building_type": "residentiel_collectif",
    "existing_building": true,
    "residential_collective": true,
    "apartment_count_heated_by_pac": 34
  },
  "operation": {
    "engagement_date": "2026-05-10",
    "completion_date": "2026-10-15",
    "usage": "chauffage_et_ecs",
    "pac_type": "air_eau",
    "heating_system_collective": true,
    "pac_nominal_power_kw": 120,
    "chaufferie_useful_power_after_works_kw": 250,
    "backup_equipment_excluded": true,
    "etas_percent": 151,
    "application_temperature": "moyenne_haute_temperature",
    "emitter_types": ["radiateurs"],
    "dhw_priority_by_pac": true
  },
  "professional": {
    "name": "Installateur Exemple",
    "rge_quality_sign": true,
    "qualification_document_provided": true
  },
  "documents": {
    "dimensioning_study": {
      "provided": true,
      "signed": true,
      "dated": true,
      "given_at_engagement": true,
      "updated_if_needed": true
    },
    "proof_of_completion": { "provided": true },
    "professional_qualification": { "provided": true },
    "manufacturer_datasheet": { "provided": true },
    "attestation_honor": { "provided": true },
    "quote_or_order": { "provided": true },
    "invoice": { "provided": true }
  },
  "non_cumulation": {
    "uses_bar_th_169": false
  }
}
